{
  "kind": "cineweave_codex_image_prompt",
  "worldId": "world-cloud-dynasty",
  "shotId": "scene-corridor-shot-03",
  "skillReceipt": {
    "repository": "https://github.com/Wilder1222/cineweave-director",
    "ref": "v3.1.0",
    "commit": "0123456789abcdef0123456789abcdef01234567",
    "contentHash": "sha256:aaaaaaaaaaaaaaaaaaaaaaaaaaaaaaaaaaaaaaaaaaaaaaaaaaaaaaaaaaaaaaaa",
    "installedBy": "codex-environment",
    "usedAt": "2026-08-20T12:00:00.000Z"
  },
  "intent": {
    "narrativePurpose": "表现沈砚秋在不暴露恐惧的情况下本能保护孩子。",
    "audienceFeeling": "警觉 → 压迫 → 克制的保护欲",
    "primaryTarget": "沈砚秋挡在孩子与追兵之间的受控动作",
    "secondaryTarget": "狭窄走廊形成的退路压力"
  },
  "shotDesign": {
    "primaryTarget": "沈砚秋的保护性重心移动",
    "shotScale": "中全景",
    "cameraAngle": "平视，以克制的正面三分之四角度观察",
    "cameraHeight": "略低于胸口高度",
    "lens": {
      "focalLengthMm": 50,
      "character": "自然身体比例与适度的走廊空间压缩感"
    },
    "depth": [
      "前景追兵武器的边缘",
      "中景沈砚秋与孩子",
      "后景被封锁的出口"
    ],
    "movementCue": {
      "type": "static",
      "direction": "沿走廊轴线保持固定机位",
      "speedCurve": "摄影机不平移，由人物动作承载节拍",
      "startState": "追兵抬起武器",
      "peakState": "人物移动到孩子与威胁之间",
      "endState": "画面停留在尚未拔剑的状态"
    },
    "focusTarget": "沈砚秋的眼神、右手与挡位关系",
    "composition": {
      "primaryTarget": "沈砚秋",
      "layout": "她位于中央偏右，孩子被她的身体部分遮挡，追兵武器从左前景进入。",
      "depthLayers": [
        "前景武器",
        "人物与孩子",
        "被封锁的走廊出口"
      ],
      "subjectScale": "人物约占画面高度六成",
      "negativeSpace": "右后方保留一小段被切断的退路"
    },
    "actionMoment": "追兵抬起武器后，她左脚后撤半步并把身体移到孩子前方，右手尚未拔剑。",
    "endState": "她保持稳定挡位，威胁尚未转化为正式攻击。",
    "styleStack": [
      {
        "label": "克制的中式幻想写实",
        "importance": "required"
      },
      {
        "label": "由表演带动的紧张感",
        "importance": "strong"
      },
      {
        "label": "自然材质响应",
        "importance": "supporting"
      }
    ]
  },
  "styleBinding": {
    "mode": "compiled",
    "stylePackageRef": {
      "id": "song-poetic-period-drama",
      "version": 1,
      "contentHash": "sha256:aaaaaaaaaaaaaaaaaaaaaaaaaaaaaaaaaaaaaaaaaaaaaaaaaaaaaaaaaaaaaaaa"
    },
    "styleCompileRef": {
      "id": "compile.song-poetic-portrait-image-01",
      "version": 1,
      "contentHash": "sha256:cccccccccccccccccccccccccccccccccccccccccccccccccccccccccccccccc"
    },
    "visualTemporalSeparated": true,
    "preserve": [
      "克制的视觉密度",
      "自然材质响应",
      "人物身份与场景事实"
    ],
    "allowedVariation": [
      "风格包允许范围内的冷暖平衡",
      "轻微的氛围浓度变化"
    ],
    "forbidden": [
      "风格引起的人物身份漂移",
      "塑料感的游戏渲染表面",
      "缺乏依据的时序声明"
    ]
  },
  "characterBindings": [
    {
      "kind": "character_binding",
      "characterSpecRef": {
        "characterId": "char.shen-yanqiu",
        "version": 1,
        "contentHash": "sha256:bbbbbbbbbbbbbbbbbbbbbbbbbbbbbbbbbbbbbbbbbbbbbbbbbbbbbbbbbbbbbbbb"
      },
      "roleInShot": "primary",
      "activeAnchorIds": [
        "face.shape",
        "eyes.horizontal",
        "mouth.asymmetry",
        "body.silhouette"
      ],
      "performanceState": {
        "stateId": "threatened",
        "emotion": "恐惧",
        "intensity": 0.38,
        "concealment": 0.82,
        "objective": "保护身后的孩子且不暴露自己的恐惧。",
        "obstacle": "狭窄走廊、持械追兵和被切断的退路。"
      },
      "actionArc": {
        "startState": "眼睛先锁定追兵双手，身体尚未后撤。",
        "trigger": "追兵抬起武器。",
        "peakState": "左脚后撤半步，身体移动到孩子与危险之间。",
        "endState": "右手靠近剑柄但仍未拔剑，重心稳定。"
      },
      "observablePerformance": {
        "posture": "上半身保持直立，重心降低，左脚后撤半步。",
        "gaze": "始终先观察对方手部，再确认出口。",
        "face": "下眼睑收紧、下颌轻微绷紧，不夸张睁眼。",
        "hands": "右手靠近剑柄，左手保持在孩子前方。",
        "breath": "动作触发前短暂停顿，随后恢复低幅度呼吸。",
        "voice": "音量不提高，语速略微变慢。"
      },
      "referenceObservationIds": [
        "OBS_FACE_FRONT_01",
        "OBS_BODY_NEUTRAL_01",
        "OBS_POSE_THREATENED_01"
      ],
      "preserve": [
        "四个当前可见身份锚点",
        "右手惯用侧",
        "受控动作幅度基线"
      ],
      "allowedDeviations": [
        "发丝被走廊气流轻微扰动",
        "衣摆因后撤动作产生有限拖曳"
      ],
      "forbiddenChanges": [
        "不得改变脸部几何",
        "不得改变头身比和肩胯关系",
        "不得把恐惧演成夸张后仰"
      ],
      "contractVersion": "2.0.0",
      "bindingId": "binding.char-shot-12-shen",
      "appearanceStateRef": {
        "appearanceStateId": "appearance.shen-duty",
        "version": 1,
        "contentHash": "sha256:cccccccccccccccccccccccccccccccccccccccccccccccccccccccccccccccc"
      }
    }
  ],
  "promptBlocks": {
    "world": [
      "云上王朝世界中的狭窄石木走廊",
      "不新增未提供的正式设定事实"
    ],
    "story": [
      "追兵抬起武器",
      "沈砚秋本能保护身后的孩子",
      "她隐藏恐惧并暂不拔剑"
    ],
    "subject": [
      "沈砚秋位于孩子与危险之间，动作克制而可读"
    ],
    "characterIdentity": [
      "偏长方圆鹅蛋脸与水平细长眼型",
      "左嘴角略高的自然不对称",
      "高腰、前臂略长、肩略宽于胯的身体剪影"
    ],
    "characterBody": [
      "7.7 头身",
      "右手惯用",
      "左脚后撤半步但上半身不后仰",
      "重心降低且稳定"
    ],
    "characterPerformance": [
      "先看追兵双手再确认出口",
      "下眼睑收紧、下颌轻微绷紧",
      "右手靠近剑柄，左手保护孩子",
      "恐惧强度 0.38、隐藏程度 0.82"
    ],
    "wardrobe": [
      "月白巡察常服",
      "腰线与右侧佩剑位置保持清晰",
      "衣摆只产生有限拖曳"
    ],
    "miseEnScene": [
      "追兵武器进入左前景",
      "人物位于中景",
      "被封锁的走廊出口位于后景"
    ],
    "camera": [
      "中全景",
      "50mm",
      "略低于胸口高度",
      "固定机位捕捉动作峰值"
    ],
    "lighting": [
      "走廊侧窗提供有动机的冷色侧光",
      "人物脚下和墙面保持接触阴影",
      "武器金属高光方向一致"
    ],
    "realism": [
      "自然人体比例与关节承重",
      "布料重量跟随有限后撤动作",
      "皮肤与木石金属具有不同反光",
      "没有塑料式全局辉光"
    ],
    "style": [
      "克制中式幻想写实",
      "表演优先于装饰",
      "压迫而非动作海报"
    ],
    "technical": [
      "单张关键帧候选",
      "不依赖特定供应商",
      "16:9 横幅构图意图"
    ],
    "sceneGeography": [
      "云宫东侧玉廊沿西南至东北单轴延伸",
      "第三开间屏风位于西北侧",
      "宫门与断桥方向不得交换"
    ],
    "sceneArchitecture": [
      "等距朱红木柱、深色瓦檐和连续白玉栏杆",
      "屏风固定于第三开间西北侧"
    ],
    "sceneMaterials": [
      "白玉半哑光湿润反射",
      "朱红漆面低光泽龟裂",
      "绢面受风轻微鼓动"
    ],
    "sceneLighting": [
      "西南低角度暖边光与东北云海冷填充",
      "柱影沿东北拉长"
    ],
    "sceneAtmosphere": [
      "暴雨前强风但尚未降雨",
      "云雾中等且不遮挡动作"
    ],
    "spatialContinuity": [
      "机位保持主轴 B 侧",
      "女主位于孩子与追兵之间",
      "追兵从西南向东北逼近"
    ],
    "sceneInteraction": [
      "双脚在白玉地面真实承重并产生接触阴影",
      "人物身体在孩子与追兵之间形成正确遮挡",
      "右手接近剑柄但未抓紧，剑仍在鞘中",
      "风从西南至东北只影响碎发和衣摆",
      "人物曝光由侧窗主光与白玉反射共同决定"
    ]
  },
  "prompt": {
    "language": "zh-CN",
    "concise": "50mm 平视中全景：沈砚秋保持偏长方圆脸、水平细长眼型、左嘴角略高和 7.7 头身；她在狭窄的朱红木柱、白玉地面走廊中左脚后撤半步，以直立上身挡住部分被遮蔽的孩子，双脚稳定承重，右手接近仍在鞘中的剑。追兵武器进入左前景，被封锁的出口位于后景；绷紧的下眼睑与下颌显露被隐藏的恐惧，西南低位暖边光与东北云海冷填充照亮人物。",
    "expanded": "平视 50mm 中全景：沈砚秋站在云上王朝狭窄的走廊中，周围是老化的朱红木构与湿润白玉。她保持偏长方圆脸、水平细长眼型、左嘴角略高、7.7 头身、高腰与略长前臂。持械追兵的武器进入左前景；她左脚后撤半步，保护部分被遮蔽的孩子，上身直立，双脚承重稳定，右手靠近仍在鞘中的剑。隐藏的恐惧只体现为下眼睑与下颌收紧。被封锁的出口始终位于身后。西南低位暖轮廓光与东北云海冷填充形成一致的接触阴影，并区分皮肤、丝绸、老化漆面、湿润白玉与金属的材质响应。"
  },
  "negativePrompt": [
    "不得改变人物身份或服装",
    "不要大圆眼或尖下巴",
    "不要夸张恐惧、向后倒下或提前拔剑",
    "不要重复肢体、悬空双脚或不可能成立的武器握持",
    "不要互相矛盾的光向或塑料感的全局辉光"
  ],
  "preserve": [
    "保留人物规范 char.shen-yanqiu 第 1 版的身份锚点",
    "右手惯用侧",
    "受控表演基线",
    "孩子始终位于人物身后"
  ],
  "allowedChanges": [
    "前景武器的裁切范围",
    "走廊薄雾浓度",
    "轻微的发丝与衣摆响应"
  ],
  "validation": {
    "onePrimaryTarget": true,
    "physicalLight": true,
    "cameraCoherent": true,
    "realismAnchors": [
      "有来源依据的侧光",
      "双脚接地与可信承重",
      "可区分的材质响应",
      "符合 50mm 镜头意图的身体比例"
    ],
    "providerNeutral": true,
    "characterBindingsResolved": true,
    "sceneBindingResolved": true,
    "crossSkillReceiptsChecked": true,
    "productionContextResolved": true,
    "interactionConstraintsResolved": true
  },
  "contractVersion": "2.0.0",
  "sceneBinding": {
    "kind": "scene_binding",
    "contractVersion": "2.0.0",
    "bindingId": "binding.scene-shot-12",
    "sceneSpecRef": {
      "sceneId": "scene.jade-corridor",
      "version": 1,
      "contentHash": "sha256:dddddddddddddddddddddddddddddddddddddddddddddddddddddddddddddddd"
    },
    "sceneStateRef": {
      "sceneStateId": "scene-state.jade-corridor-storm",
      "version": 1,
      "contentHash": "sha256:eeeeeeeeeeeeeeeeeeeeeeeeeeeeeeeeeeeeeeeeeeeeeeeeeeeeeeeeeeeeeeee"
    },
    "roleInShot": "primary_environment",
    "activeAnchorIds": [
      "geo.main-axis",
      "arch.jade-rail",
      "scale.column-bays",
      "occlusion.screen"
    ],
    "activeZoneIds": [
      "zone.main-corridor",
      "zone.screen-bay"
    ],
    "cameraPlacement": {
      "cameraAnchorId": "camera.screen-side",
      "zoneId": "zone.screen-bay",
      "axisId": "axis.main-corridor",
      "side": "B",
      "height": "成人肩高",
      "orientation": "沿主轴朝西南回看追兵"
    },
    "spatialRelations": [
      {
        "subjectRef": "char.shen-yanqiu@1",
        "zoneId": "zone.screen-bay",
        "relation": "位于孩子与追兵之间，靠屏风东北侧",
        "screenDirection": "面向画面左下的追兵，身体仍沿主轴",
        "eyelineTarget": "追兵双手"
      },
      {
        "subjectRef": "char.child-01@1",
        "zoneId": "zone.screen-bay",
        "relation": "位于女主东北后方半步",
        "screenDirection": "沿主轴向东北",
        "eyelineTarget": "女主肩部"
      }
    ],
    "depthPlan": {
      "foreground": [
        "屏风木格与一根朱红立柱"
      ],
      "midground": [
        "女主、孩子与白玉地面"
      ],
      "background": [
        "沿主轴逼近的追兵、宫门方向低角度暖光"
      ]
    },
    "lightingState": {
      "key": "西南低角度暖光只勾勒追兵与柱边",
      "fill": "东北云海冷光照亮女主正侧面",
      "practicals": [
        "檐角铜铃上的小面积反光"
      ],
      "shadowDirection": "柱影沿东北拉长",
      "atmosphere": "中等云雾和统一向东北的风压"
    },
    "materialResponse": [
      "白玉地面出现低饱和湿润反射",
      "朱红木柱保持低光泽和漆面龟裂",
      "屏风绢面受风轻微鼓动"
    ],
    "referenceObservationIds": [
      "OBS_SCENE_AXIS_01",
      "OBS_SCENE_MATERIAL_01"
    ],
    "preserve": [
      "主轴与 B 侧机位",
      "第三开间屏风",
      "宫门暖光方向",
      "白玉与朱红材质体系"
    ],
    "allowedDeviations": [
      "云雾可在不遮挡动作的范围内变化",
      "铜铃和绢面可响应风"
    ],
    "forbiddenChanges": [
      "不得跨轴",
      "不得交换宫门与断桥方向",
      "不得把屏风移到前景另一侧",
      "不得生成无支撑机位"
    ],
    "interactionConstraints": {
      "contacts": [
        {
          "contactId": "contact.shen-floor",
          "subjectBindingId": "binding.char-shot-12-shen",